word_1,def_1-1,qual_1-1_start,qual_1-1_end,def_1-2,qual_1-2_start,qual_1-2_end,def_1-3,qual_1-3_start,qual_1-3_end,def_1-4,qual_1-4_start,qual_1-4_end,def_1-5,qual_1-5_start,qual_1-5_end,def_1-6,qual_1-6_start,qual_1-6_end,def_1-7,qual_1-7_start,qual_1-7_end,word_2,def_2-1,qual_2-1_start,qual_2-1_end,def_2-2,qual_2-2_start,qual_2-2_end,def_2-3,qual_2-3_start,qual_2-3_end,def_2-4,qual_2-4_start,qual_2-4_end,def_2-5,qual_2-5_start,qual_2-5_end,def_2-6,qual_2-6_start,qual_2-6_end,def_2-7,qual_2-7_start,qual_2-7_end,relationship
linking,"make a logical or causal connection",,,"connect, fasten, or put together two or more pieces",,,"be or become joined or united or linked",,,"link with or as with a yoke",,,,<!--,-->,,<!--,-->,,<!--,-->,linkage,"an associative relation",,,"(genetics) traits that tend to be inherited together as a consequence of an association between their genes; all of the genes of a given chromosome are linked (where one goes they all go)",,,"a mechanical system of rods or springs or pivots that transmits power or motion",,,"the act of linking things together",,,,<!--,-->,,<!--,-->,,<!--,-->,RelatedTo
inferential,"relating to or having the nature of illation or inference",,,"of reasoning; proceeding from general premisses to a necessary and specific conclusion",,,"resembling or dependent on or arrived at by inference",,,"derived or capable of being derived by inference",,,"based on interpretation; not directly expressed",,,,<!--,-->,,<!--,-->,logic,"the branch of philosophy that analyzes inference",,,"reasoned and reasonable judgment",,,"the principles that guide reasoning within a given field or situation",,,"the system of operations performed by a computer that underlies the machine's representation of logical operations",,,"a system of reasoning",,,,<!--,-->,,<!--,-->,HasContext
horse,"solid-hoofed herbivorous quadruped domesticated since prehistoric times",,,"a padded gymnastic apparatus on legs",,,"troops trained to fight on horseback",,,"a framework for holding wood that is being sawed",,,"a chessman shaped to resemble the head of a horse; can move two squares horizontally and one vertically (or vice versa)",,,"provide with a horse or horses",,,,<!--,-->,cowboys,"a hired hand who tends cattle and performs other duties on horseback",,,"a performer who gives exhibitions of riding and roping and bulldogging",,,"someone who is reckless or irresponsible (especially in driving vehicles)",,,,<!--,-->,,<!--,-->,,<!--,-->,,<!--,-->,RelatedTo
fact,"a piece of information about circumstances that exist or events that have occurred",,,"a statement or assertion of verified information about something that is the case or has happened",,,"an event known to have happened or something known to have existed",,,"a concept whose truth can be proved",,,,<!--,-->,,<!--,-->,,<!--,-->,reality,"all of your experiences that determine how things appear to you",,,"the state of being actual or real",,,"the state of the world as it really is rather than as you might want it to be",,,"the quality possessed by something that is real",,,,<!--,-->,,<!--,-->,,<!--,-->,IsA
fomentation,"a substance used as a warm moist medicinal compress or poultice",,,"application of warm wet coverings to a part of the body to relieve pain and inflammation",,,"deliberate and intentional triggering (of trouble or discord)",,,,<!--,-->,,<!--,-->,,<!--,-->,,<!--,-->,treatment,"care provided to improve a situation (especially medical procedures or applications that are intended to relieve illness or injury)",,,"the management of someone or something",,,"a manner of dealing with something artistically",,,"an extended communication (often interactive) dealing with some particular topic",,,,<!--,-->,,<!--,-->,,<!--,-->,IsA
elective,"a course that the student can select from among alternatives",,,"subject to popular election",,,"not compulsory",,,,<!--,-->,,<!--,-->,,<!--,-->,,<!--,-->,facultative,"of or relating to the mental faculties",,,"able to exist under more than one set of conditions",,,"granting a privilege or permission or power to do or not do something",,,"not compulsory",,,,<!--,-->,,<!--,-->,,<!--,-->,Synonym
quality,"an essential and distinguishing attribute of something or someone; --Shakespeare",,,"a degree or grade of excellence or worth",,,"a characteristic property that defines the apparent individual nature of something",,,"(music) the distinctive property of a complex sound (a voice or noise or musical sound)",,,"high social status",,,"of superior grade",,,"of high social status",,,materials,"the tangible substance that goes into the makeup of a physical object",,,"information (data or ideas or observations) that can be used or reworked into a finished form",,,"artifact made by weaving or felting or knitting or crocheting natural or synthetic fibers",,,"things needed for doing or making something",,,"a person judged suitable for admission or employment",,,,<!--,-->,,<!--,-->,RelatedTo
destroyed,"do away with, cause the destruction or undoing of",,,"destroy completely; damage irreparably",,,"defeat soundly",,,"put (an animal) to death",,,"spoiled or ruined or demolished",,,"destroyed physically or morally",,,,<!--,-->,damaged,"inflict damage upon",,,"suffer or be susceptible to damage",,,"harmed or injured or spoiled",,,"being unjustly brought into disrepute",,,,<!--,-->,,<!--,-->,,<!--,-->,RelatedTo
gravy,"a sauce made by adding stock, flour, or other ingredients to the juice and fat that drips from cooking meats",,,"the seasoned but not thickened juices that drip from cooking meats; often a little water is added",,,"a sudden happening that brings good fortune (as a sudden opportunity to make money)",,,,<!--,-->,,<!--,-->,,<!--,-->,,<!--,-->,turkey,"large gallinaceous bird with fan-shaped tail; widely domesticated for food",,,"a Eurasian republic in Asia Minor and the Balkans; on the collapse of the Ottoman Empire in 1918, the Young Turks, led by Kemal Ataturk, established a republic in 1923",,,"a person who does something thoughtless or annoying",,,"flesh of large domesticated fowl usually roasted",,,"an event that fails badly or is totally ineffectual",,,,<!--,-->,,<!--,-->,RelatedTo
inset,"a small picture inserted within the bounds or a larger one",,,"an artifact that is inserted or is to be inserted",,,"a piece of material used to strengthen or enlarge a garment",,,"set or place in",,,,<!--,-->,,<!--,-->,,<!--,-->,gusset,"a piece of chain mail covering a place unprotected by armor plate",,,"a metal plate used to strengthen a joist",,,"a piece of material used to strengthen or enlarge a garment",,,,<!--,-->,,<!--,-->,,<!--,-->,,<!--,-->,Synonym
mode,"how something is done or how it happens",,,"a particular functioning condition or arrangement",,,"a classification of propositions on the basis of whether they claim necessity or possibility or impossibility",,,"verb inflections that express how the action or state is conceived by the speaker",,,"any of various fixed orders of the various diatonic notes within an octave",,,"the most frequent value of a random variable",,,,<!--,-->,physics,"the science of matter and energy and their interactions",,,"the physical properties, phenomena, and laws of something",,,"a purging medicine; stimulates evacuation of the bowels",,,,<!--,-->,,<!--,-->,,<!--,-->,,<!--,-->,HasContext
ordinate,"the value of a coordinate on the vertical axis",,,"appoint to a clerical posts",,,"bring (components or parts) into proper or desirable coordination correlation",,,,<!--,-->,,<!--,-->,,<!--,-->,,<!--,-->,align,"place in a line or arrange so as to be parallel or straight",,,"be or come into adjustment with",,,"align oneself with a group or a way of thinking",,,"bring (components or parts) into proper or desirable coordination correlation",,,,<!--,-->,,<!--,-->,,<!--,-->,Synonym
musing,"a calm, lengthy, intent consideration",,,"reflect deeply on a subject",,,"deeply or seriously thoughtful",,,,<!--,-->,,<!--,-->,,<!--,-->,,<!--,-->,broody,"a domestic hen ready to brood",,,"physiologically ready to incubate eggs",,,"deeply or seriously thoughtful",,,,<!--,-->,,<!--,-->,,<!--,-->,,<!--,-->,Synonym
peace,"the state prevailing during the absence of war",,,"harmonious relations; freedom from disputes",,,"the absence of mental stress or anxiety",,,"the general security of public places",,,"a treaty to cease hostilities",,,,<!--,-->,,<!--,-->,hippies,"a youth subculture (mostly from the middle class) originating in San Francisco in the 1960s; advocated universal love and peace and communes and long hair and soft drugs; favored acid rock and progressive rock music",,,"someone who rejects the established culture; advocates extreme liberalism in politics and lifestyle",,,"someone who rejects the established culture; advocates extreme liberalism in politics and lifestyle",,,,<!--,-->,,<!--,-->,,<!--,-->,,<!--,-->,RelatedTo
e,"a fat-soluble vitamin that is essential for normal reproduction; an important antioxidant that neutralizes free radicals in the body",,,"a radioactive transuranic element produced by bombarding plutonium with neutrons",,,"the cardinal compass point that is at 90 degrees",,,"the base of the natural system of logarithms; approximately equal to 2.718282...",,,"the 5th letter of the Roman alphabet",,,,<!--,-->,,<!--,-->,emergency,"a sudden unforeseen crisis (usually involving danger) that requires immediate action",,,"a state in which martial law applies",,,"a brake operated by hand; usually operates by mechanical linkage",,,,<!--,-->,,<!--,-->,,<!--,-->,,<!--,-->,RelatedTo
hassle,"an angry disturbance",,,"disorderly fighting",,,"annoy continually or chronically",,,,<!--,-->,,<!--,-->,,<!--,-->,,<!--,-->,fuss,"an excited state of agitation",,,"an angry disturbance",,,"a quarrel about petty points",,,"a rapid active commotion",,,"worry unnecessarily or excessively",,,"care for like a mother",,,,<!--,-->,Synonym
innocence,"the quality of innocent naivete",,,"the state of being unsullied by sin or moral wrong; lacking a knowledge of evil",,,"a state or condition of being innocent of a specific crime or offense",,,,<!--,-->,,<!--,-->,,<!--,-->,,<!--,-->,absence,"the state of being absent",,,"failure to be present",,,"the time interval during which something or somebody is away",,,"the occurrence of an abrupt, transient loss or impairment of consciousness (which is not subsequently remembered), sometimes with light twitching, fluttering eyelids, etc.; common in petit mal epilepsy",,,,<!--,-->,,<!--,-->,,<!--,-->,RelatedTo
literal,"a mistake in printed matter resulting from mechanical failures of some kind",,,"being or reflecting the essential or genuine character of something; ; - G.K.Chesterton",,,"without interpretation or embellishment",,,"limited to the explicit meaning of a word or text",,,"avoiding embellishment or exaggeration (used for emphasis)",,,,<!--,-->,,<!--,-->,liberties,"immunity from arbitrary exercise of authority: political independence",,,"freedom of choice",,,"personal freedom from servitude or confinement or oppression",,,"leave granted to a sailor or naval officer",,,"an act of undue intimacy",,,,<!--,-->,,<!--,-->,RelatedTo
debar,"bar temporarily; from school, office, etc.",,,"prevent the occurrence of; prevent from happening",,,"prevent from entering; keep out",,,,<!--,-->,,<!--,-->,,<!--,-->,,<!--,-->,suspend,"hang freely",,,"cause to be held in suspension in a fluid",,,"bar temporarily; from school, office, etc.",,,"stop a process or a habit by imposing a freeze on it",,,"make inoperative or stop",,,"render temporarily ineffective",,,,<!--,-->,Synonym
strawberries,"sweet fleshy red fruit",,,"any of various low perennial herbs with many runners and bearing white flowers followed by edible fruits having many small achenes scattered on the surface of an enlarged red pulpy berry",,,"a soft red birthmark",,,,<!--,-->,,<!--,-->,,<!--,-->,,<!--,-->,forest,"the trees and other plants in a large densely wooded area",,,"land that is covered with trees and shrubs",,,"establish a forest on previously unforested land",,,,<!--,-->,,<!--,-->,,<!--,-->,,<!--,-->,AtLocation
separateness,"the state of being several and distinct",,,"political independence",,,"the quality of being not alike; being distinct or different from that otherwise experienced or known",,,,<!--,-->,,<!--,-->,,<!--,-->,,<!--,-->,independence,"freedom from control or influence of another or others",,,"the successful ending of the American Revolution",,,"a city in western Missouri; the beginning of the Santa Fe Trail",,,,<!--,-->,,<!--,-->,,<!--,-->,,<!--,-->,IsA
battle,"a hostile meeting of opposing military forces in the course of a war",,,"an energetic attempt to achieve something",,,"an open clash between two opposing groups (or individuals); --Thomas Paine",,,"battle or contend against in or as if in a battle",,,,<!--,-->,,<!--,-->,,<!--,-->,war,"the waging of armed conflict against an enemy",,,"a legal state created by a declaration of war and ended by official declaration during which the international rules of war apply",,,"an active struggle between competing entities",,,"a concerted campaign to end something that is injurious",,,"make or wage war",,,,<!--,-->,,<!--,-->,RelatedTo
banning,"an official prohibition or edict against something",,,"forbid the public distribution of ( a movie or a newspaper)",,,"prohibit especially by legal means or social pressure",,,"ban from a place of residence, as for punishment",,,"expel from a community or group",,,,<!--,-->,,<!--,-->,prohibition,"a law forbidding the sale of alcoholic beverages",,,"a decree that prohibits something",,,"the period from 1920 to 1933 when the sale of alcoholic beverages was prohibited in the United States by a constitutional amendment",,,"refusal to approve or assent to",,,"the action of prohibiting or inhibiting or forbidding (or an instance thereof)",,,,<!--,-->,,<!--,-->,RelatedTo
scheduling,"setting an order and time for planned events",,,"plan for an activity or event",,,"make a schedule; plan the time and place for events",,,,<!--,-->,,<!--,-->,,<!--,-->,,<!--,-->,commerce,"transactions (sales and purchases) having the objective of supplying commodities (goods and services)",,,"the United States federal department that promotes and administers domestic and foreign trade (including management of the census and the patent office); created in 1913",,,"social exchange, especially of opinions, attitudes, etc.",,,,<!--,-->,,<!--,-->,,<!--,-->,,<!--,-->,RelatedTo
plank,"a stout length of sawn timber; made in a wide variety of sizes and used for many purposes",,,"an endorsed policy in the platform of a political party",,,"cover with planks",,,"set (something or oneself) down with or as if with a noise",,,"cook and serve on a plank",,,,<!--,-->,,<!--,-->,executions,"putting a condemned person to death",,,"the act of performing; of doing something successfully; using knowledge as distinguished from merely possessing it",,,"(computer science) the process of carrying out an instruction by a computer",,,"(law) the completion of a legal instrument (such as a contract or deed) by signing it (and perhaps sealing and delivering it) so that it becomes legally binding and enforceable",,,"a routine court order that attempts to enforce the judgment that has been granted to a plaintiff by authorizing a sheriff to carry it out",,,"the act of accomplishing some aim or executing some order",,,"unlawful premeditated killing of a human being by a human being",,,RelatedTo
clumped,"make or move along with a sound as of a horse's hooves striking the ground",,,"come together as in a cluster or flock",,,"walk clumsily",,,"gather or cause to gather into a cluster",,,,<!--,-->,,<!--,-->,,<!--,-->,clump,"a grouping of a number of similar things",,,"a compact mass",,,"a heavy dull sound (as made by impact of heavy objects)",,,"make or move along with a sound as of a horse's hooves striking the ground",,,"come together as in a cluster or flock",,,"walk clumsily",,,"gather or cause to gather into a cluster",,,FormOf
steamer,"a clam that is usually steamed in the shell",,,"a cooking utensil that can be used to cook food by steaming it",,,"a ship powered by one or more steam engines",,,"an edible clam with thin oval-shaped shell found in coastal regions of the United States and Europe",,,"travel by means of steam power",,,,<!--,-->,,<!--,-->,session,"a meeting for execution of a group's functions",,,"the time during which a school holds classes",,,"a meeting devoted to a particular activity",,,"a meeting of spiritualists",,,,<!--,-->,,<!--,-->,,<!--,-->,RelatedTo
buffeting,"repeated heavy blows",,,"strike against forcefully",,,"strike, beat repeatedly",,,,<!--,-->,,<!--,-->,,<!--,-->,,<!--,-->,buffet,"a piece of furniture that stands at the side of a dining room; has shelves and drawers",,,"a meal set out on a buffet at which guests help themselves",,,"usually inexpensive bar",,,"strike against forcefully",,,"strike, beat repeatedly",,,,<!--,-->,,<!--,-->,RelatedTo
fashion,"how something is done or how it happens",,,"characteristic or habitual practice",,,"the latest and most admired style in clothes and cosmetics and behavior",,,"consumer goods (especially clothing) in the current mode",,,"make out of components (often in an improvising manner)",,,,<!--,-->,,<!--,-->,codes,"a set of rules or principles or laws (especially written ones)",,,"a coding system used for transmitting messages requiring brevity or secrecy",,,"(computer science) the symbolic arrangement of data or instructions in a computer program or the set of such instructions",,,"attach a code to",,,"convert ordinary language into code",,,"fool or hoax",,,"harass with persistent criticism or carping",,,RelatedTo
chihuahua,"a city in northern Mexico in the state of Chihuahua; commercial center of northern Mexico",,,"a state in northern Mexico; mostly high plateau",,,"an old breed of tiny short-haired dog with protruding eyes from Mexico held to antedate Aztec civilization",,,,<!--,-->,,<!--,-->,,<!--,-->,,<!--,-->,desert,"arid land with little or no vegetation",,,"leave someone who needs or counts on you; leave in the lurch",,,"desert (a cause, a country or an army), often in order to join the opposing cause, country, or army",,,"leave behind",,,,<!--,-->,,<!--,-->,,<!--,-->,RelatedTo
castrated,"deprive of strength or vigor",,,"edit by omitting or modifying parts considered indelicate",,,"remove the testicles of a male animal",,,"remove the ovaries of",,,"deprived of sexual capacity or sexual attributes",,,,<!--,-->,,<!--,-->,emasculated,"deprive of strength or vigor",,,"remove the testicles of a male animal",,,"(of a male animal) having the testicles removed",,,,<!--,-->,,<!--,-->,,<!--,-->,,<!--,-->,SimilarTo
toggle,"any instruction that works first one way and then the other; it turns something on the first time it is used and then turns it off the next time",,,"a hinged switch that can assume either of two positions",,,"a fastener consisting of a peg or pin or crosspiece that is inserted into an eye at the end of a rope or a chain or a cable in order to fasten it to something (as another rope or chain or cable)",,,"provide with a toggle or toggles",,,"fasten with, or as if with, a toggle",,,"release by a toggle switch",,,,<!--,-->,bight,"a loop in a rope",,,"a bend or curve (especially in a coastline)",,,"a broad bay formed by an indentation in the shoreline",,,"the middle part of a slack rope (as distinguished from its ends)",,,"fasten with a bight",,,,<!--,-->,,<!--,-->,RelatedTo
fowl,"a domesticated gallinaceous bird thought to be descended from the red jungle fowl",,,"the flesh of a bird or fowl (wild or domestic) used as food",,,"hunt fowl",,,"hunt fowl in the forest",,,,<!--,-->,,<!--,-->,,<!--,-->,partridge,"flesh of either quail or grouse",,,"heavy-bodied small-winged South American game bird resembling a gallinaceous bird but related to the ratite birds",,,"small Old World gallinaceous game birds",,,"a popular North American game bird; named for its call",,,"valued as a game bird in eastern United States and Canada",,,,<!--,-->,,<!--,-->,RelatedTo
spa,"a health resort near a spring or at the seaside",,,"a fashionable hotel usually in a resort area",,,"a place of business with equipment and facilities for exercising and improving physical fitness",,,,<!--,-->,,<!--,-->,,<!--,-->,,<!--,-->,slang,"informal language consisting of words and expressions that are not considered appropriate for formal occasions; often vituperative or vulgar",,,"a characteristic language of a particular group (as among thieves)",,,"use slang or vulgar language",,,"fool or hoax",,,"abuse with coarse language",,,,<!--,-->,,<!--,-->,HasContext
children,"a young person of either sex",,,"a human offspring (son or daughter) of any age",,,"an immature childish person",,,"a member of a clan or tribe",,,,<!--,-->,,<!--,-->,,<!--,-->,devious,"indirect in departing from the accepted or proper way; misleading",,,"characterized by insincerity or deceit; evasive",,,"deviating from a straight course",,,,<!--,-->,,<!--,-->,,<!--,-->,,<!--,-->,HasProperty
memories,"something that is remembered",,,"the cognitive processes whereby past experience is remembered",,,"the power of retaining and recalling past experience",,,"an electronic memory device",,,"the area of cognitive psychology that studies memory processes",,,,<!--,-->,,<!--,-->,information,"a message received and understood",,,"knowledge acquired through study or experience or instruction",,,"formal accusation of a crime",,,"a collection of facts from which conclusions may be drawn",,,"(communication theory) a numerical measure of the uncertainty of an outcome",,,,<!--,-->,,<!--,-->,IsA
longitudinally,"across time",,,"in the direction of the length",,,"with respect to longitude",,,,<!--,-->,,<!--,-->,,<!--,-->,,<!--,-->,sample,"a small part of something intended as representative of the whole",,,"items selected at random from a population and used to test hypotheses about the population",,,"all or part of a natural object that is collected and preserved as an example of its class",,,"take a sample of",,,,<!--,-->,,<!--,-->,,<!--,-->,RelatedTo
springing,"move forward by leaps and bounds",,,"develop into a distinctive entity",,,"spring back; spring away from an impact",,,"develop suddenly",,,"produce or disclose suddenly or unexpectedly",,,,<!--,-->,,<!--,-->,us,"North American republic containing 50 states - 48 conterminous states in North America plus Alaska in northwest North America and the Hawaiian Islands in the Pacific Ocean; achieved independence in 1776",,,"a base containing nitrogen that is found in RNA (but not in DNA) and derived from pyrimidine; pairs with adenine",,,"a heavy toxic silvery-white radioactive metallic element; occurs in many isotopes; used for nuclear fuels and nuclear weapons",,,"the 21st letter of the Roman alphabet",,,,<!--,-->,,<!--,-->,,<!--,-->,HasContext
distress,"psychological suffering",,,"a state of adversity (danger or affliction or need)",,,"extreme physical pain",,,"the seizure and holding of property as security for payment of a debt or satisfaction of a claim",,,"bring into difficulties or distress, especially financial hardship",,,"cause mental pain to",,,,<!--,-->,griping,"acute abdominal pain (especially in infants)",,,"complain",,,"hold fast or firmly",,,"to grip or seize, as in a wrestling match",,,"to render motionless, as with a fixed stare or by arousing terror or awe",,,,<!--,-->,,<!--,-->,Synonym
fatigues,"military uniform worn by military personnel when doing menial labor",,,"temporary loss of strength and energy resulting from hard physical or mental work",,,"used of materials (especially metals) in a weakened state caused by long stress",,,"(always used with a modifier) boredom resulting from overexposure to something",,,"labor of a nonmilitary kind done by soldiers (cleaning or digging or draining or so on)",,,"lose interest or become bored with something or somebody",,,"exhaust or get tired through overuse or great strain or stress",,,fatigue,"temporary loss of strength and energy resulting from hard physical or mental work",,,"used of materials (especially metals) in a weakened state caused by long stress",,,"(always used with a modifier) boredom resulting from overexposure to something",,,"labor of a nonmilitary kind done by soldiers (cleaning or digging or draining or so on)",,,"lose interest or become bored with something or somebody",,,"exhaust or get tired through overuse or great strain or stress",,,,<!--,-->,DerivedFrom
voluntary,"(military) a person who freely enlists for service",,,"composition (often improvised) for a solo instrument (especially solo organ) and not a regular part of a religious service or musical performance",,,"of your own free will or design; done by choice; not forced or compelled",,,"controlled by individual volition",,,,<!--,-->,,<!--,-->,,<!--,-->,willing,"the act of making a choice",,,"decree or ordain",,,"determine by choice",,,"leave or give by will after one's death",,,"disposed or inclined toward",,,"not brought about by coercion or force",,,,<!--,-->,RelatedTo
ewe,"a member of a people living in southern Benin and Togo and southeastern Ghana",,,"a Kwa language spoken by the Ewe in Ghana and Togo and Benin",,,"female sheep",,,,<!--,-->,,<!--,-->,,<!--,-->,,<!--,-->,language,"a systematic means of communicating by the use of sounds or conventional symbols",,,"(language) communication by word of mouth",,,"the text of a popular song or musical-comedy number",,,"the cognitive processes involved in producing and understanding linguistic communication",,,"the mental faculty or power of vocal communication",,,"a system of words used to name things in a particular discipline",,,,<!--,-->,RelatedTo
