word_1,def_1-1,qual_1-1_start,qual_1-1_end,def_1-2,qual_1-2_start,qual_1-2_end,def_1-3,qual_1-3_start,qual_1-3_end,def_1-4,qual_1-4_start,qual_1-4_end,def_1-5,qual_1-5_start,qual_1-5_end,def_1-6,qual_1-6_start,qual_1-6_end,def_1-7,qual_1-7_start,qual_1-7_end,word_2,def_2-1,qual_2-1_start,qual_2-1_end,def_2-2,qual_2-2_start,qual_2-2_end,def_2-3,qual_2-3_start,qual_2-3_end,def_2-4,qual_2-4_start,qual_2-4_end,def_2-5,qual_2-5_start,qual_2-5_end,def_2-6,qual_2-6_start,qual_2-6_end,def_2-7,qual_2-7_start,qual_2-7_end,relationship
intake,"the process of taking food into the body through the mouth (as by eating)",,,"an opening through which fluid is admitted to a tube or container",,,"the act of inhaling; the drawing in of air (or other gases) as in breathing",,,,<!--,-->,,<!--,-->,,<!--,-->,,<!--,-->,fluid,"a substance that is fluid at room temperature and pressure",,,"continuous amorphous matter that tends to flow and to conform to the outline of its container: a liquid or a gas",,,"subject to change; variable",,,"characteristic of a fluid; capable of flowing and easily changing shape",,,"smooth and unconstrained in movement",,,"in cash or easily convertible to cash",,,"affording change (especially in social status)",,,RelatedTo
besieging,"the action of an armed force that surrounds a fortified place and isolates it while continuing to attack",,,"surround so as to force to give up",,,"cause to feel distressed or worried",,,"harass, as with questions or requests",,,,<!--,-->,,<!--,-->,,<!--,-->,besiege,"surround so as to force to give up",,,"cause to feel distressed or worried",,,"harass, as with questions or requests",,,,<!--,-->,,<!--,-->,,<!--,-->,,<!--,-->,RelatedTo
preferences,"a strong liking",,,"a predisposition in favor of something",,,"the right or chance to choose",,,"grant of favor or advantage to one over another (especially to a country or countries in matters of international trade, such as levying duties)",,,,<!--,-->,,<!--,-->,,<!--,-->,user,"a person who makes use of a thing; someone who uses or employs something",,,"a person who uses something or someone selfishly or unethically",,,"a person who takes drugs",,,,<!--,-->,,<!--,-->,,<!--,-->,,<!--,-->,RelatedTo
afoot,"traveling by foot",,,"currently in progress",,,"on foot; walking",,,,<!--,-->,,<!--,-->,,<!--,-->,,<!--,-->,progress,"gradual improvement or growth or development",,,"the act of moving forward (as toward a goal)",,,"a movement forward",,,"develop in a positive way",,,"move forward, also in the metaphorical sense",,,"form or accumulate steadily",,,,<!--,-->,RelatedTo
inflexible,"incapable of change",,,"not making concessions",,,"resistant to being bent",,,"incapable of adapting or changing to meet circumstances",,,,<!--,-->,,<!--,-->,,<!--,-->,unbending,"straighten up or out; make straight",,,"unfasten, as a sail, from a spar or a stay",,,"free from flexure",,,"make less taut",,,"become less tense, rest, or take one's ease",,,"release from mental strain, tension, or formality",,,"incapable of adapting or changing to meet circumstances",,,Synonym
mute,"a deaf person who is unable to speak",,,"a device used to soften the tone of a musical instrument",,,"deaden (a sound or noise), especially by wrapping",,,"expressed without speech; ; ; - Emily Dickinson; ; ; - Thomas Wolfe",,,"unable to speak because of hereditary deafness",,,,<!--,-->,,<!--,-->,muffle,"a kiln with an inner chamber for firing things at a low temperature",,,"conceal or hide",,,"deaden (a sound or noise), especially by wrapping",,,,<!--,-->,,<!--,-->,,<!--,-->,,<!--,-->,Synonym
irony,"witty language used to convey insults or scorn; ; ; --Jonathan Swift",,,"incongruity between what might be expected and what actually occurs",,,"a trope that involves incongruity between what is expected and what occurs",,,,<!--,-->,,<!--,-->,,<!--,-->,,<!--,-->,theatrical,"a performance of a play",,,"of or relating to the theater",,,"suited to or characteristic of the stage or theater",,,,<!--,-->,,<!--,-->,,<!--,-->,,<!--,-->,RelatedTo
script,"a written version of a play or other dramatic composition; used in preparing for a performance",,,"something written by hand",,,"a particular orthography or writing system",,,"write a script for",,,,<!--,-->,,<!--,-->,,<!--,-->,original,"an original creation (i.e., an audio recording) from which copies can be made",,,"something that serves as a model or a basis for making copies",,,"preceding all others in time or being as first made or performed",,,"(of e.g. information) not secondhand or by way of something intermediary",,,"being or productive of something fresh and unusual; or being as first made or thought of",,,"not derived or copied or translated from something else",,,,<!--,-->,RelatedTo
oil,"a slippery or viscous liquid or liquefiable substance not miscible with water",,,"oil paint containing pigment that is used by an artist",,,"a dark oil consisting mainly of hydrocarbons",,,"any of a group of liquid edible fats that are obtained from plants",,,"cover with oil, as if by rubbing",,,"administer an oil or ointment to ; often in a religious ceremony of blessing",,,,<!--,-->,slickness,"verbal misrepresentation intended to take advantage of you in some way",,,"a kind of fluent easy superficiality",,,"a slippery smoothness",,,,<!--,-->,,<!--,-->,,<!--,-->,,<!--,-->,RelatedTo
fang,"a Bantu language spoken in Cameroon",,,"an appendage of insects that is capable of injecting venom; usually evolved from the legs",,,"canine tooth of a carnivorous animal; used to seize and tear its prey",,,"hollow or grooved tooth of a venomous snake; used to inject its poison",,,,<!--,-->,,<!--,-->,,<!--,-->,noose,"a trap for birds or small mammals; often has a slip noose",,,"a loop formed in a cord or rope by means of a slipknot; it binds tighter as the cord or rope is pulled",,,"make a noose in or of",,,"secure with a noose",,,,<!--,-->,,<!--,-->,,<!--,-->,RelatedTo
irruption,"a sudden violent entrance; a bursting in",,,"a sudden sharp increase in the relative numbers of a population",,,"a sudden violent spontaneous occurrence (usually of some undesirable condition)",,,,<!--,-->,,<!--,-->,,<!--,-->,,<!--,-->,abrupt,"marked by sudden changes in subject and sharp transitions",,,"exceedingly sudden and unexpected",,,"extremely steep",,,"surprisingly and unceremoniously brusque in manner",,,,<!--,-->,,<!--,-->,,<!--,-->,RelatedTo
wax,"any of various substances of either mineral origin or plant or animal origin; they are solid at normal temperatures and insoluble in water",,,"cover with wax",,,"go up or advance",,,"increase in phase",,,,<!--,-->,,<!--,-->,,<!--,-->,creates,"make or cause to be or to become",,,"bring into existence",,,"pursue a creative activity; be engaged in a creative activity",,,"invest with a new title, office, or rank",,,"create by artistic means",,,"create or manufacture a man-made product",,,,<!--,-->,RelatedTo
blowout,"an easy victory",,,"a sudden malfunction of a part or apparatus",,,"a gay festivity",,,,<!--,-->,,<!--,-->,,<!--,-->,,<!--,-->,extreme,"the furthest or highest degree of something",,,"the point located farthest from the middle of something",,,"of the greatest possible degree or extent or intensity",,,"far beyond a norm in quantity or amount or degree; to an utmost degree",,,"beyond a norm in views or actions",,,"most distant in any direction",,,,<!--,-->,RelatedTo
gravity,"(physics) the force of attraction between all masses in the universe; especially the attraction of the earth's mass for bodies near its surface; ; ; --Albert Einstein",,,"a manner that is serious and solemn",,,"a solemn and dignified feeling",,,,<!--,-->,,<!--,-->,,<!--,-->,,<!--,-->,heaviness,"the property of being comparatively great in weight",,,"persisting sadness",,,"an oppressive quality that is laborious and solemn and lacks grace or fluency",,,"used of a line or mark",,,"unwelcome burdensome difficulty",,,,<!--,-->,,<!--,-->,RelatedTo
people,"(plural) any group of human beings (men or women or children) collectively",,,"the body of citizens of a state or country",,,"members of a family line",,,"the common people generally",,,"fill with people",,,"furnish with people",,,,<!--,-->,clerks,"an employee who performs clerical work (e.g., keeps records or accounts)",,,"a salesperson in a store",,,"work as a clerk, as in the legal business",,,,<!--,-->,,<!--,-->,,<!--,-->,,<!--,-->,IsA
deny,"declare untrue; contradict",,,"refuse to accept or believe",,,"refuse to grant, as of a petition or request",,,"refuse to let have",,,"deny oneself (something); restrain, especially from indulging in some pleasure",,,"deny formally (an allegation of fact by the opposing party) in a legal suit",,,"refuse to recognize or acknowledge",,,traverse,"a horizontal beam that extends across something",,,"a horizontal crosspiece across a window or separating a door from a window over it",,,"taking a zigzag path on skis",,,"travel across",,,"travel across or pass over",,,"to cover or extend over an area or time period; ,",,,"deny formally (an allegation of fact by the opposing party) in a legal suit",,,Synonym
premier,"the person who holds the position of head of the government in the United Kingdom",,,"the person who is head of state (in several countries)",,,"be performed for the first time",,,"perform a work for the first time",,,"first in rank or degree",,,"preceding all others in time",,,,<!--,-->,slang,"informal language consisting of words and expressions that are not considered appropriate for formal occasions; often vituperative or vulgar",,,"a characteristic language of a particular group (as among thieves)",,,"use slang or vulgar language",,,"fool or hoax",,,"abuse with coarse language",,,,<!--,-->,,<!--,-->,HasContext
chaotic,"lacking a visible order or organization",,,"completely unordered and unpredictable and confusing",,,"of or relating to a sensitive dependence on initial conditions",,,,<!--,-->,,<!--,-->,,<!--,-->,,<!--,-->,disarray,"a mental state characterized by a lack of clear and orderly thought and behavior",,,"untidiness (especially of clothing and appearance)",,,"bring disorder to",,,,<!--,-->,,<!--,-->,,<!--,-->,,<!--,-->,RelatedTo
helix,"a curve that lies on the surface of a cylinder or cone and cuts the element at a constant angle",,,"a structure consisting of something wound in a continuous series of loops",,,"type genus of the family Helicidae",,,,<!--,-->,,<!--,-->,,<!--,-->,,<!--,-->,perpendicular,"a straight line at right angles to another line",,,"a Gothic style in 14th and 15th century England; characterized by vertical lines and a four-centered (Tudor) arch and fan vaulting",,,"a cord from which a metal weight is suspended pointing directly to the earth's center of gravity; used to determine the vertical from a given point",,,"an extremely steep face",,,"intersecting at or forming right angles",,,"at right angles to the plane of the horizon or a base line",,,"extremely steep",,,RelatedTo
coasters,"a resident of a coastal area",,,"someone who coasts",,,"a covering (plate or mat) that protects the surface of a table (i.e., from the condensation on a cold glass or bottle)",,,,<!--,-->,,<!--,-->,,<!--,-->,,<!--,-->,drawer,"a boxlike container in a piece of furniture; made so as to slide in and out",,,"the person who writes a check or draft instructing the drawee to pay someone else",,,"an artist skilled at drawing",,,,<!--,-->,,<!--,-->,,<!--,-->,,<!--,-->,AtLocation
nettled,"sting with or as with nettles and cause a stinging pain or sensation",,,"cause annoyance in; disturb, especially by minor irritations",,,"aroused to impatience or anger",,,,<!--,-->,,<!--,-->,,<!--,-->,,<!--,-->,irritated,"cause annoyance in; disturb, especially by minor irritations",,,"excite to an abnormal condition, or chafe or inflame",,,"excite to some characteristic action or condition, such as motion, contraction, or nervous impulse, by the application of a stimulus",,,"aroused to impatience or anger",,,,<!--,-->,,<!--,-->,,<!--,-->,Synonym
puckered,"to gather something into small wrinkles or folds",,,"draw together into folds or puckers",,,"become wrinkled or drawn together",,,,<!--,-->,,<!--,-->,,<!--,-->,,<!--,-->,pucker,"an irregular fold in an otherwise even surface (as in cloth)",,,"to gather something into small wrinkles or folds",,,"draw together into folds or puckers",,,"become wrinkled or drawn together",,,,<!--,-->,,<!--,-->,,<!--,-->,FormOf
tall,"a garment size for a tall person",,,"great in vertical dimension; high in stature",,,"lofty in style",,,"impressively difficult",,,"too improbable to admit of belief",,,,<!--,-->,,<!--,-->,vertical,"something that is oriented vertically",,,"a vertical structural member as a post or stake",,,"at right angles to the plane of the horizon or a base line",,,"relating to or involving all stages of a business from production to distribution",,,"upright in position or posture",,,"of or relating to different levels in a hierarchy (as levels of social class or income group)",,,,<!--,-->,RelatedTo
guttural,"a consonant articulated in the back of the mouth or throat",,,"like the sounds of frogs and crows",,,"relating to or articulated in the throat",,,,<!--,-->,,<!--,-->,,<!--,-->,,<!--,-->,articulate,"provide with a joint",,,"put into words or an expression",,,"speak, pronounce, or utter in a certain way",,,"unite by forming a joint or joints",,,"express or state clearly",,,"expressing yourself easily or characterized by clear expressive language",,,"consisting of segments held together by joints",,,RelatedTo
modulus,"an integer that can be divided without remainder into the difference between two other integers",,,"the absolute value of a complex number",,,"(physics) a coefficient that expresses how much of a specified property is possessed by a specified substance",,,,<!--,-->,,<!--,-->,,<!--,-->,,<!--,-->,operator,"(mathematics) a symbol or function representing a mathematical operation",,,"an agent that operates some apparatus or machine",,,"someone who owns or operates a business",,,"a shrewd or unscrupulous person who knows how to circumvent difficulties",,,"a speculator who trades aggressively on stock or commodity markets",,,,<!--,-->,,<!--,-->,RelatedTo
suspension,"a mixture in which fine particles are suspended in a fluid where they are supported by buoyancy",,,"a time interval during which there is a temporary cessation of something",,,"temporary cessation or suspension",,,"an interruption in the intensity or amount of something",,,"a mechanical system of springs or shock absorbers connecting the wheels and axles to the chassis of a wheeled vehicle",,,"the act of suspending something (hanging it from above so it moves freely)",,,"a temporary debarment (from a privilege or position etc)",,,suspending,"hang freely",,,"cause to be held in suspension in a fluid",,,"bar temporarily; from school, office, etc.",,,"stop a process or a habit by imposing a freeze on it",,,"make inoperative or stop",,,"render temporarily ineffective",,,,<!--,-->,RelatedTo
hammered,"beat with or as if with a hammer",,,"create by hammering",,,"shaped or worked with a hammer and often showing hammer marks",,,,<!--,-->,,<!--,-->,,<!--,-->,,<!--,-->,slang,"informal language consisting of words and expressions that are not considered appropriate for formal occasions; often vituperative or vulgar",,,"a characteristic language of a particular group (as among thieves)",,,"use slang or vulgar language",,,"fool or hoax",,,"abuse with coarse language",,,,<!--,-->,,<!--,-->,HasContext
art,"the products of human creativity; works of art collectively",,,"the creation of beautiful or significant things",,,"a superior skill that you can learn by study and practice and observation",,,"photographs or other visual representations in a printed publication",,,,<!--,-->,,<!--,-->,,<!--,-->,includes,"have as a part, be made up out of",,,"consider as part of something",,,"add as part of something else; put in as part of a set, group, or category",,,"allow participation in or the right to be part of; permit to exercise the rights, functions, and responsibilities of",,,,<!--,-->,,<!--,-->,,<!--,-->,RelatedTo
degrading,"reduce the level of land, as by erosion",,,"reduce in worth or character, usually verbally",,,"lower the grade of something; reduce its worth",,,"harmful to the mind or morals",,,"used of conduct; characterized by dishonor",,,,<!--,-->,,<!--,-->,degrade,"reduce the level of land, as by erosion",,,"reduce in worth or character, usually verbally",,,"lower the grade of something; reduce its worth",,,,<!--,-->,,<!--,-->,,<!--,-->,,<!--,-->,FormOf
warrant,"a writ from a court commanding police to perform specified acts",,,"a type of security issued by a corporation (usually together with a bond or preferred stock) that gives the holder the right to purchase a certain amount of common stock at a stated price",,,"formal and explicit approval",,,"a written assurance that some product or service will be provided or will meet certain specifications",,,"show to be reasonable or provide adequate ground for",,,"stand behind and guarantee the quality, accuracy, or condition of",,,,<!--,-->,judicial,"decreed by or proceeding from a court of justice",,,"belonging or appropriate to the office of a judge",,,"relating to the administration of justice or the function of a judge",,,"expressing careful judgment; ; -Tyler Dennett",,,,<!--,-->,,<!--,-->,,<!--,-->,RelatedTo
availed,"use to one's advantage",,,"be of use to, be useful to",,,"take or use",,,,<!--,-->,,<!--,-->,,<!--,-->,,<!--,-->,avail,"a means of serving",,,"use to one's advantage",,,"be of use to, be useful to",,,"take or use",,,,<!--,-->,,<!--,-->,,<!--,-->,RelatedTo
peers,"a person who is of equal standing with another in a group",,,"a nobleman (duke or marquis or earl or viscount or baron) who is a member of the British peerage",,,"look searchingly",,,,<!--,-->,,<!--,-->,,<!--,-->,,<!--,-->,piers,"a platform built out from the shore into the water and supported by piles; provides access to ships and boats",,,"(architecture) a vertical supporting structure (as a portion of wall between two doors or windows)",,,"a support for two adjacent bridge spans",,,,<!--,-->,,<!--,-->,,<!--,-->,,<!--,-->,RelatedTo
thumb,"the thick short innermost digit of the forelimb",,,"the part of a glove that provides a covering for the thumb",,,"a convex molding having a cross section in the form of a quarter of a circle or of an ellipse",,,"travel by getting free rides from motorists",,,"look through a book or other written material",,,"feel or handle with the fingers",,,,<!--,-->,frequent,"do one's shopping at; do business with; be a customer or client of",,,"be a regular or frequent visitor to a certain place",,,"coming at short intervals or habitually",,,"frequently encountered",,,,<!--,-->,,<!--,-->,,<!--,-->,RelatedTo
shears,"large scissors with strong blades",,,"(physics) a deformation of an object in which parallel planes remain parallel but are shifted in a direction parallel to themselves",,,"a large edge tool that cuts sheet metal by passing a blade through it",,,"cut with shears",,,"shear the wool from",,,"cut or cut through with shears",,,"become deformed by forces tending to produce a shearing strain",,,shear,"(physics) a deformation of an object in which parallel planes remain parallel but are shifted in a direction parallel to themselves",,,"a large edge tool that cuts sheet metal by passing a blade through it",,,"cut with shears",,,"shear the wool from",,,"cut or cut through with shears",,,"become deformed by forces tending to produce a shearing strain",,,,<!--,-->,Synonym
perturb,"disturb in mind or make uneasy or cause to be worried or alarmed",,,"disturb or interfere with the usual path of an electron or atom",,,"cause a celestial body to deviate from a theoretically regular orbital motion, especially as a result of interposed or extraordinary gravitational pull",,,"throw into great confusion or disorder",,,,<!--,-->,,<!--,-->,,<!--,-->,disorder,"a physical condition in which there is a disturbance of normal functioning",,,"a condition in which things are not in their expected places",,,"a disturbance of the peace or of public order",,,"disturb in mind or make uneasy or cause to be worried or alarmed",,,"bring disorder to",,,,<!--,-->,,<!--,-->,MannerOf
pacific,"the largest ocean in the world",,,"relating to or bordering the Pacific Ocean",,,"disposed to peace or of a peaceful nature",,,"promoting peace",,,,<!--,-->,,<!--,-->,,<!--,-->,peaceable,"inclined or disposed to peace",,,"not disturbed by strife or turmoil or war",,,"disposed to peace or of a peaceful nature",,,,<!--,-->,,<!--,-->,,<!--,-->,,<!--,-->,Synonym
detailing,"an individualized description of a particular instance",,,"provide details for",,,"assign to a specific task",,,,<!--,-->,,<!--,-->,,<!--,-->,,<!--,-->,detail,"an isolated fact that is considered separately from the whole",,,"a small part that can be considered separately from the whole",,,"extended treatment of particulars",,,"a crew of workers selected for a particular task",,,"a temporary military unit",,,"provide details for",,,"assign to a specific task",,,FormOf
lamella,"any of the radiating leaflike spore-producing structures on the underside of the cap of a mushroom or similar fungus",,,"a thin membrane that is one of the calcified layers that form bones",,,"thin plate",,,,<!--,-->,,<!--,-->,,<!--,-->,,<!--,-->,gill,"a British imperial capacity unit (liquid or dry) equal to 5 fluid ounces or 142.066 cubic centimeters",,,"a United States liquid unit equal to 4 fluid ounces",,,"any of the radiating leaflike spore-producing structures on the underside of the cap of a mushroom or similar fungus",,,"respiratory organ of aquatic animals that breathe oxygen dissolved in water",,,,<!--,-->,,<!--,-->,,<!--,-->,Synonym
horse,"solid-hoofed herbivorous quadruped domesticated since prehistoric times",,,"a padded gymnastic apparatus on legs",,,"troops trained to fight on horseback",,,"a framework for holding wood that is being sawed",,,"a chessman shaped to resemble the head of a horse; can move two squares horizontally and one vertically (or vice versa)",,,"provide with a horse or horses",,,,<!--,-->,sporty,"exhibiting or calling for sportsmanship or fair play",,,"(used especially of clothes) marked by conspicuous display",,,"appropriate for sport or engagement in a sport",,,,<!--,-->,,<!--,-->,,<!--,-->,,<!--,-->,RelatedTo
finger,"any of the terminal members of the hand (sometimes excepting the thumb)",,,"the length of breadth of a finger used as a linear measure",,,"one of the parts of a glove that provides covering for a finger or thumb",,,"feel or handle with the fingers",,,"examine by touch",,,"search for on the computer",,,"indicate the fingering for the playing of musical scores for keyboard instruments",,,digit,"one of the elements that collectively form a system of numeration",,,"the length of breadth of a finger used as a linear measure",,,"a finger or toe in human beings or corresponding body part in other vertebrates",,,,<!--,-->,,<!--,-->,,<!--,-->,,<!--,-->,RelatedTo
genet,"French diplomat who in 1793 tried to draw the United States into the war between France and England (1763-1834)",,,"French writer of novels and dramas for the theater of the absurd (1910-1986)",,,"agile Old World viverrine having a spotted coat and long ringed tail",,,,<!--,-->,,<!--,-->,,<!--,-->,,<!--,-->,genetic,"occurring among members of a family usually by heredity",,,"of or relating to or produced by or being a gene",,,"pertaining to or referring to origin",,,"of or relating to the science of genetics",,,,<!--,-->,,<!--,-->,,<!--,-->,RelatedTo
published,"put into print",,,"prepare and issue for public distribution or sale",,,"have (one's written work) issued for publication",,,"prepared and printed for distribution and sale",,,"formally made public",,,,<!--,-->,,<!--,-->,promulgated,"state or announce",,,"put a law into effect by formal declaration",,,"formally made public",,,,<!--,-->,,<!--,-->,,<!--,-->,,<!--,-->,Synonym
mush,"any soft or soggy mass",,,"cornmeal boiled in water",,,"writing or music that is excessively sweet and sentimental",,,"a journey by dogsled",,,"drive (a team of dogs or a dogsled)",,,"travel with a dogsled",,,,<!--,-->,grits,"coarsely ground hulled corn boiled as a breakfast dish in the southern United States",,,"a hard coarse-grained siliceous sandstone",,,"fortitude and determination",,,"cover with a grit",,,"clench together",,,,<!--,-->,,<!--,-->,RelatedTo
flirt,"a seductive woman who uses her sex appeal to exploit men",,,"playful behavior intended to arouse sexual interest",,,"talk or behave amorously, without serious intentions",,,"behave carelessly or indifferently",,,,<!--,-->,,<!--,-->,,<!--,-->,dally,"behave carelessly or indifferently",,,"waste time",,,"talk or behave amorously, without serious intentions",,,"consider not very seriously",,,,<!--,-->,,<!--,-->,,<!--,-->,Synonym
linger,"remain present although waning or gradually dying",,,"be about",,,"leave slowly and hesitantly",,,"take one's time; proceed slowly",,,"move to and fro",,,,<!--,-->,,<!--,-->,tarry,"be about",,,"leave slowly and hesitantly",,,"having the characteristics of pitch or tar",,,,<!--,-->,,<!--,-->,,<!--,-->,,<!--,-->,Synonym
