word_1,def_1-1,qual_1-1_start,qual_1-1_end,def_1-2,qual_1-2_start,qual_1-2_end,def_1-3,qual_1-3_start,qual_1-3_end,def_1-4,qual_1-4_start,qual_1-4_end,def_1-5,qual_1-5_start,qual_1-5_end,def_1-6,qual_1-6_start,qual_1-6_end,def_1-7,qual_1-7_start,qual_1-7_end,word_2,def_2-1,qual_2-1_start,qual_2-1_end,def_2-2,qual_2-2_start,qual_2-2_end,def_2-3,qual_2-3_start,qual_2-3_end,def_2-4,qual_2-4_start,qual_2-4_end,def_2-5,qual_2-5_start,qual_2-5_end,def_2-6,qual_2-6_start,qual_2-6_end,def_2-7,qual_2-7_start,qual_2-7_end,relationship
prevarication,"a statement that deviates from or perverts the truth",,,"intentionally vague or ambiguous",,,"the deliberate act of deviating from the truth",,,,<!--,-->,,<!--,-->,,<!--,-->,,<!--,-->,historical,"of or relating to the study of history",,,"having once lived or existed or taken place in the real world as distinct from being legendary",,,"belonging to the past; of what is important or famous in the past",,,"used of the study of a phenomenon (especially language) as it changes through time",,,,<!--,-->,,<!--,-->,,<!--,-->,HasContext
surround,"the area in which something exists or lives",,,"extend on all sides of simultaneously; encircle",,,"envelop completely",,,"surround so as to force to give up",,,"surround with a wall in order to fortify",,,,<!--,-->,,<!--,-->,fence,"a barrier that serves to enclose an area",,,"a dealer in stolen property",,,"enclose with a fence",,,"receive stolen goods",,,"fight with fencing swords",,,"surround with a wall in order to fortify",,,"have an argument about something",,,RelatedTo
door,"a swinging or sliding barrier that will close the entrance to a room or building or vehicle",,,"the entrance (the space in a wall) through which you enter or leave a room or building; the space that a door can close",,,"anything providing a means of access (or escape)",,,"a structure where people live or work (usually ordered along a street or road)",,,"a room that is entered via a door",,,,<!--,-->,,<!--,-->,slamming,"close violently",,,"strike violently",,,"dance the slam dance",,,"throw violently",,,,<!--,-->,,<!--,-->,,<!--,-->,RelatedTo
thrumming,"sound with a monotonous hum",,,"sound the strings of (a string instrument)",,,"make a rhythmic sound",,,,<!--,-->,,<!--,-->,,<!--,-->,,<!--,-->,thrum,"a thrumming sound",,,"sound with a monotonous hum",,,"sound the strings of (a string instrument)",,,"make a rhythmic sound",,,,<!--,-->,,<!--,-->,,<!--,-->,RelatedTo
confidence,"freedom from doubt; belief in yourself and your abilities",,,"a feeling of trust (in someone or something)",,,"a state of confident hopefulness that events will be favorable",,,"a trustful relationship",,,"a secret that is confided or entrusted to another",,,,<!--,-->,,<!--,-->,attitude,"a complex mental state involving beliefs and feelings and values and dispositions to act in certain ways",,,"the arrangement of the body and its limbs",,,"a theatrical pose created for effect",,,"position of aircraft or spacecraft relative to a frame of reference (the horizon or direction of motion)",,,,<!--,-->,,<!--,-->,,<!--,-->,IsA
splays,"an outward bevel around a door or window that makes it seem larger",,,"spread open or apart",,,"turn outward",,,"move out of position",,,,<!--,-->,,<!--,-->,,<!--,-->,splay,"an outward bevel around a door or window that makes it seem larger",,,"spread open or apart",,,"turn outward",,,"move out of position",,,"turned outward in an ungainly manner",,,,<!--,-->,,<!--,-->,FormOf
beatification,"a state of supreme happiness",,,"the action of rendering supremely blessed and extremely happy",,,"(Roman Catholic Church) an act of the Pope who declares that a deceased person lived a holy life and is worthy of public veneration; a first step toward canonization",,,,<!--,-->,,<!--,-->,,<!--,-->,,<!--,-->,roman_catholic,"a member of the Roman Catholic Church",,,"the Christian Church based in the Vatican and presided over by a pope and an episcopal hierarchy",,,"of or relating to or supporting Romanism",,,,<!--,-->,,<!--,-->,,<!--,-->,,<!--,-->,HasContext
drip,"flowing in drops; the formation and falling of drops of liquid",,,"the sound of a liquid falling drop by drop",,,"(architecture) a projection from a cornice or sill designed to protect the area below from rainwater (as over a window or doorway)",,,"fall in drops",,,"let or cause to fall in drops",,,,<!--,-->,,<!--,-->,descend,"move downward and lower, but not necessarily all the way",,,"come from; be connected by a relationship of blood, for example",,,"do something that one considers to be below one's dignity",,,"come as if by falling",,,,<!--,-->,,<!--,-->,,<!--,-->,MannerOf
blinked,"briefly shut the eyes",,,"force to go away by blinking",,,"gleam or glow intermittently",,,,<!--,-->,,<!--,-->,,<!--,-->,,<!--,-->,blink,"a reflex that closes and opens the eyes rapidly",,,"briefly shut the eyes",,,"force to go away by blinking",,,"gleam or glow intermittently",,,,<!--,-->,,<!--,-->,,<!--,-->,RelatedTo
ameliorating,"to make better",,,"get better",,,"tending to ameliorate",,,,<!--,-->,,<!--,-->,,<!--,-->,,<!--,-->,bettering,"surpass in excellence",,,"to make better",,,"get better",,,"changing for the better",,,,<!--,-->,,<!--,-->,,<!--,-->,SimilarTo
redundancy,"repetition of messages to reduce the probability of errors in transmission",,,"the attribute of being superfluous and unneeded",,,"(electronics) a system design that duplicates components to provide alternatives in case one component fails",,,"repetition of an act needlessly",,,,<!--,-->,,<!--,-->,,<!--,-->,survival,"a state of surviving; remaining alive",,,"a natural process resulting in the evolution of organisms best adapted to the environment",,,"something that survives",,,,<!--,-->,,<!--,-->,,<!--,-->,,<!--,-->,RelatedTo
mist,"a thin fog with condensation near the ground",,,"become covered with mist",,,"make less visible or unclear",,,"spray finely or cover with mist",,,,<!--,-->,,<!--,-->,,<!--,-->,sprayed,"be discharged in sprays of liquid",,,"scatter in a mass or jet of droplets",,,"cover by spraying with a liquid",,,,<!--,-->,,<!--,-->,,<!--,-->,,<!--,-->,RelatedTo
boat,"a small vessel for travel on water",,,"a dish (often boat-shaped) for serving gravy or sauce",,,"ride in a boat on water",,,,<!--,-->,,<!--,-->,,<!--,-->,,<!--,-->,chair,"a seat for one person, with a support for the back",,,"the position of professor",,,"the officer who presides at the meetings of an organization",,,"an instrument of execution by electrocution; resembles an ordinary seat for one person",,,"a particular seat in an orchestra",,,"act or preside as chair, as of an academic department in a university",,,"preside over",,,RelatedTo
skipper,"a student who fails to attend classes",,,"an officer who is licensed to command a merchant ship",,,"the naval officer in command of a military ship",,,"work as the skipper on a vessel",,,,<!--,-->,,<!--,-->,,<!--,-->,attend,"be present at (meetings, church services, university), etc.",,,"take charge of or deal with",,,"to accompany as a circumstance or follow as a result",,,"work for or be a servant to",,,"give heed (to)",,,,<!--,-->,,<!--,-->,RelatedTo
grading,"the act of arranging in a graduated series",,,"changing the ground level to a smooth horizontal or gently sloping surface",,,"evaluation of performance by assigning a grade or score",,,"assign a rank or rating to",,,"level to the right gradient",,,"assign a grade or rank to, according to one's evaluation",,,"determine the grade of or assign a grade to",,,gradation,"relative position in a graded series",,,"a degree of ablaut",,,"the act of arranging in grades",,,,<!--,-->,,<!--,-->,,<!--,-->,,<!--,-->,RelatedTo
moralizing,"indulgence in moral pronouncements; the exposition (often superficially) of a particular moral code",,,"interpret the moral meaning of",,,"speak as if delivering a sermon; express moral judgements",,,"improve the morals of",,,,<!--,-->,,<!--,-->,,<!--,-->,moralize,"interpret the moral meaning of",,,"speak as if delivering a sermon; express moral judgements",,,"improve the morals of",,,,<!--,-->,,<!--,-->,,<!--,-->,,<!--,-->,RelatedTo
overtaking,"going by something that is moving in order to get in front of it",,,"catch up with and possibly overtake",,,"travel past",,,"overcome, as with emotions or perceptual stimuli",,,,<!--,-->,,<!--,-->,,<!--,-->,overtake,"catch up with and possibly overtake",,,"travel past",,,"overcome, as with emotions or perceptual stimuli",,,,<!--,-->,,<!--,-->,,<!--,-->,,<!--,-->,FormOf
nasturtium,"any tropical American plant of the genus Tropaeolum having pungent juice and long-spurred yellow to red flowers",,,"aquatic herbs",,,"flowers and seeds and leaves all used as flavorings",,,,<!--,-->,,<!--,-->,,<!--,-->,,<!--,-->,watercress,"any of several water-loving cresses",,,"cresses that grow in clear ponds and streams",,,"of a moderate yellow-green color that is greener and deeper than moss green and yellower and darker than pea green",,,,<!--,-->,,<!--,-->,,<!--,-->,,<!--,-->,RelatedTo
menace,"something that is a source of danger",,,"a threat or the act of threatening",,,"pose a threat to; present a danger to",,,"express a threat either by an utterance or a gesture",,,"act in a threatening manner",,,,<!--,-->,,<!--,-->,annoying,"the act of troubling or annoying someone",,,"cause annoyance in; disturb, especially by minor irritations",,,"causing irritation or annoyance",,,,<!--,-->,,<!--,-->,,<!--,-->,,<!--,-->,RelatedTo
volunteers,"(military) a person who freely enlists for service",,,"a person who performs voluntary work",,,"a native or resident of Tennessee",,,"tell voluntarily",,,"agree freely",,,"do volunteer work",,,,<!--,-->,volunteer,"(military) a person who freely enlists for service",,,"a person who performs voluntary work",,,"a native or resident of Tennessee",,,"tell voluntarily",,,"agree freely",,,"do volunteer work",,,"without payment",,,FormOf
rabbit,"any of various burrowing animals of the family Leporidae having long ears and short tails; some domesticated and raised for pets or food",,,"the fur of a rabbit",,,"flesh of any of various rabbits or hares (wild or domesticated) eaten as food",,,"hunt rabbits",,,,<!--,-->,,<!--,-->,,<!--,-->,hares,"swift timid long-eared mammal larger than a rabbit having a divided upper lip and long hind legs; young born furred and with open eyes",,,"flesh of any of various rabbits or hares (wild or domesticated) eaten as food",,,"run quickly, like a hare",,,,<!--,-->,,<!--,-->,,<!--,-->,,<!--,-->,RelatedTo
mercenary,"a person hired to fight for another country than their own",,,"marked by materialism",,,"serving for wages in a foreign army",,,"profit oriented; ; - John Buchan",,,,<!--,-->,,<!--,-->,,<!--,-->,greedy,"immoderately desirous of acquiring e.g. wealth",,,"(often followed by `for') ardently or excessively desirous",,,"wanting to eat or drink more than one can reasonably consume",,,,<!--,-->,,<!--,-->,,<!--,-->,,<!--,-->,Synonym
distributor,"someone who markets merchandise",,,"a person with authority to allot or deal out or apportion",,,"a company that markets merchandise",,,"electrical device that distributes voltage to the spark plugs of a gasoline engine in the order of the firing sequence",,,,<!--,-->,,<!--,-->,,<!--,-->,electric,"a car that is powered by electricity",,,"using or providing or producing or transmitting or operated by electricity",,,"(of a situation) exceptionally tense",,,"affected by emotion as if by electricity; thrilling",,,,<!--,-->,,<!--,-->,,<!--,-->,RelatedTo
espouse,"choose and follow; as of theories, ideas, policies, strategies or plans",,,"take in marriage",,,"take up the cause, ideology, practice, method, of someone and use it as one's own",,,,<!--,-->,,<!--,-->,,<!--,-->,,<!--,-->,married,"a person who is married",,,"take in marriage",,,"perform a marriage ceremony",,,"joined in matrimony",,,"of or relating to the state of marriage",,,,<!--,-->,,<!--,-->,RelatedTo
clinging,"come or be in close contact with; stick or hold together and resist separation",,,"to remain emotionally or intellectually attached",,,"hold on tightly or tenaciously",,,,<!--,-->,,<!--,-->,,<!--,-->,,<!--,-->,cling,"fruit (especially peach) whose flesh adheres strongly to the pit",,,"come or be in close contact with; stick or hold together and resist separation",,,"to remain emotionally or intellectually attached",,,"hold on tightly or tenaciously",,,,<!--,-->,,<!--,-->,,<!--,-->,FormOf
chrome,"another word for chromium when it is used in dyes or pigments",,,"plate with chromium",,,"treat with a chromium compound",,,,<!--,-->,,<!--,-->,,<!--,-->,,<!--,-->,metal,"any of several chemical elements that are usually shiny solids that conduct heat or electricity and can be formed into sheets etc.",,,"a mixture containing two or more metallic elements or metallic and nonmetallic elements usually fused together or dissolving into each other when molten",,,"cover with metal",,,"containing or made of or resembling or characteristic of a metal; ; ; - Ambrose Bierce",,,,<!--,-->,,<!--,-->,,<!--,-->,RelatedTo
maladjusted,"poorly adjusted to demands and stresses of daily living",,,"emotionally unstable and having difficulty coping with personal relationships",,,"not well adjusted",,,,<!--,-->,,<!--,-->,,<!--,-->,,<!--,-->,cope,"brick that is laid sideways at the top of a wall",,,"a long cloak; worn by a priest or bishop on ceremonial occasions",,,"come to terms with",,,,<!--,-->,,<!--,-->,,<!--,-->,,<!--,-->,RelatedTo
campaign,"a race between candidates for elective office",,,"a series of actions advancing a principle or tending toward a particular end",,,"several related operations aimed at achieving a particular goal (usually within geographical and temporal constraints)",,,"an overland journey by hunters (especially in Africa)",,,"run, stand, or compete for an office or a position",,,"exert oneself continuously, vigorously, or obtrusively to gain an end or engage in a crusade for a certain cause or person; be an advocate for",,,"go on a campaign; go off to war",,,undertaken,"enter upon an activity or enterprise",,,"accept as a challenge",,,"promise to do or accomplish",,,"enter into a contractual arrangement",,,"accept as a charge",,,,<!--,-->,,<!--,-->,RelatedTo
communication,"the activity of communicating; the activity of conveying information",,,"something that is communicated by or to or between people or groups",,,"a connection allowing access between persons or places",,,,<!--,-->,,<!--,-->,,<!--,-->,,<!--,-->,organs,"edible viscera of a butchered animal",,,"a fully differentiated structural and functional unit in an animal that is specialized for some particular function",,,"a government agency or instrument devoted to the performance of some specific function",,,"(music) an electronic simulation of a pipe organ",,,"a periodical that is published by a special interest group",,,"wind instrument whose sound is produced by means of pipes arranged in sets supplied with air from a bellows and controlled from a large complex musical keyboard",,,"a free-reed instrument in which air is forced through the reeds by bellows",,,RelatedTo
inoculating,"the act of protecting against disease by introducing a vaccine into the body to induce immunity",,,"introduce an idea or attitude into the mind of",,,"introduce a microorganism into",,,"perform vaccinations or produce immunity in by inoculation",,,"insert a bud for propagation",,,"impregnate with the virus or germ of a disease in order to render immune",,,,<!--,-->,protection,"the activity of protecting someone or something",,,"a covering that is intend to protect from damage or injury",,,"defense against financial failure; financial independence",,,"the condition of being protected",,,"kindly endorsement and guidance",,,"the imposition of duties or quotas on imports in order to protect domestic industry against foreign competition",,,"payment extorted by gangsters on threat of violence",,,IsA
cruised,"drive around aimlessly but ostentatiously and at leisure",,,"travel at a moderate speed",,,"look for a sexual partner in a public place",,,"sail or travel about for pleasure, relaxation, or sightseeing",,,,<!--,-->,,<!--,-->,,<!--,-->,cruise,"an ocean trip taken for pleasure",,,"drive around aimlessly but ostentatiously and at leisure",,,"travel at a moderate speed",,,"look for a sexual partner in a public place",,,"sail or travel about for pleasure, relaxation, or sightseeing",,,,<!--,-->,,<!--,-->,RelatedTo
aeolian,"a member of one of four linguistic divisions of the prehistoric Greeks",,,"the ancient Greek inhabitants of Aeolia",,,"of or pertaining to Aeolus, the Greek god of the winds; relating to or caused by the wind",,,"of or relating to Aeolis or its ancient Greek people",,,,<!--,-->,,<!--,-->,,<!--,-->,cotton,"soft silky fibers from cotton plants in their raw state",,,"fabric woven from cotton fibers",,,"erect bushy mallow plant or small tree bearing bolls containing seeds with many long hairy fibers",,,"thread made of cotton fibers",,,"take a liking to",,,,<!--,-->,,<!--,-->,RelatedTo
medicine,"the branches of medical science that deal with nonsurgical techniques",,,"(medicine) something that treats or prevents or alleviates the symptoms of disease",,,"the learned profession that is mastered by graduate training in a medical school and that is devoted to preventing or alleviating or curing diseases and injuries",,,"punishment for one's actions",,,"treat medicinally, treat with medicine",,,,<!--,-->,,<!--,-->,curing,"the process of becoming hard or solid by cooling or drying or crystallization",,,"provide a cure for, make healthy again",,,"prepare by drying, salting, or chemical processing in order to preserve",,,"make (substances) hard and improve their usability",,,"be or become preserved",,,,<!--,-->,,<!--,-->,RelatedTo
chartreuse,"aromatic green or yellow liqueur flavored with orange peel and hyssop and peppermint oils; made at monastery near Grenoble, France",,,"a shade of green tinged with yellow",,,"of something having the yellowish green color of Chartreuse liqueur",,,,<!--,-->,,<!--,-->,,<!--,-->,,<!--,-->,pottery,"ceramic ware made from clay and baked in a kiln",,,"the craft of making earthenware",,,"a workshop where clayware is made",,,,<!--,-->,,<!--,-->,,<!--,-->,,<!--,-->,RelatedTo
helix,"a curve that lies on the surface of a cylinder or cone and cuts the element at a constant angle",,,"a structure consisting of something wound in a continuous series of loops",,,"type genus of the family Helicidae",,,,<!--,-->,,<!--,-->,,<!--,-->,,<!--,-->,external,"outward features",,,"happening or arising or located outside or beyond some limits or especially surface",,,"coming from the outside",,,"from or between other countries",,,"purely outward or superficial; ; - A.R.Gurney,Jr.",,,,<!--,-->,,<!--,-->,RelatedTo
uproot,"move (people) forcibly from their homeland into a new and foreign environment",,,"destroy completely, as if down to the roots",,,"pull up by or as if by the roots",,,,<!--,-->,,<!--,-->,,<!--,-->,,<!--,-->,displace,"cause to move, usually with force or pressure",,,"take the place of or have precedence over",,,"terminate the employment of; discharge from an office or position",,,"cause to move or shift into a new position or place, both in a concrete and in an abstract sense",,,,<!--,-->,,<!--,-->,,<!--,-->,Synonym
bombarded,"cast, hurl, or throw repeatedly with some missile",,,"throw bombs at or attack with bombs",,,"address with continuously or persistently, as if with a barrage",,,"direct high energy particles or radiation against",,,,<!--,-->,,<!--,-->,,<!--,-->,bombard,"a large shawm; the bass member of the shawm family",,,"cast, hurl, or throw repeatedly with some missile",,,"throw bombs at or attack with bombs",,,"address with continuously or persistently, as if with a barrage",,,"direct high energy particles or radiation against",,,,<!--,-->,,<!--,-->,RelatedTo
partitioning,"an analysis into mutually exclusive categories",,,"the act of dividing or partitioning; separation by the creation of a boundary that divides or keeps apart",,,"divide into parts, pieces, or sections",,,"separate or apportion into sections",,,,<!--,-->,,<!--,-->,,<!--,-->,breakdown,"the act of disrupting an established order so it fails to continue",,,"a mental or physical breakdown",,,"a cessation of normal operation",,,"an analysis into mutually exclusive categories",,,,<!--,-->,,<!--,-->,,<!--,-->,Synonym
spectacular,"a lavishly produced performance",,,"sensational in appearance or thrilling in effect",,,"characteristic of spectacles or drama",,,"having a quality that thrusts itself into attention",,,,<!--,-->,,<!--,-->,,<!--,-->,species,"(biology) taxonomic group whose members can interbreed",,,"a specific kind of something",,,"coins collectively",,,,<!--,-->,,<!--,-->,,<!--,-->,,<!--,-->,RelatedTo
spouting,"gush forth in a sudden stream or jet",,,"talk in a noisy, excited, or declamatory manner",,,"propelled violently in a usually narrow stream",,,,<!--,-->,,<!--,-->,,<!--,-->,,<!--,-->,guttering,"burn unsteadily, feebly, or low; flicker",,,"flow in small streams",,,"wear or cut gutters into",,,"provide with gutters",,,,<!--,-->,,<!--,-->,,<!--,-->,RelatedTo
sale,"a particular instance of selling",,,"the general activity of selling",,,"an occasion (usually brief) for buying at specially reduced prices",,,"the state of being purchasable; offered or exhibited for selling",,,"an agreement (or contract) in which property is transferred from the seller (vendor) to the buyer (vendee) for a fixed price in money (paid or agreed to be paid by the buyer)",,,,<!--,-->,,<!--,-->,discounts,"the act of reducing the selling price of merchandise",,,"interest on an annual basis deducted in advance on a loan",,,"a refund of some fraction of the amount paid",,,"an amount or percentage deducted",,,"bar from attention or consideration",,,"give a reduction in price on",,,,<!--,-->,RelatedTo
singular,"the form of a word that is used to denote a singleton",,,"unusual or striking",,,"beyond or deviating from the usual or expected",,,"being a single and separate person or thing; ; -William James",,,"composed of one member, set, or kind",,,"grammatical number category referring to a single item or unit",,,"the single one of its kind",,,kind,"a category of things distinguished by some common characteristic or quality",,,"having or showing a tender and considerate and helpful nature; used especially of persons and their behavior",,,"agreeable, conducive to comfort",,,"tolerant and forgiving under provocation",,,,<!--,-->,,<!--,-->,,<!--,-->,RelatedTo
boarder,"a tenant in someone's house",,,"someone who forces their way aboard ship",,,"a pupil who lives at school during term time",,,,<!--,-->,,<!--,-->,,<!--,-->,,<!--,-->,surfing,"the sport of riding a surfboard toward the shore on the crest of a wave",,,"ride the waves of the sea with a surfboard",,,"look around casually and randomly, without seeking anything in particular",,,"switch channels, on television",,,,<!--,-->,,<!--,-->,,<!--,-->,RelatedTo
garnering,"acquire or deserve by one's efforts or actions",,,"store grain",,,"assemble or get together",,,,<!--,-->,,<!--,-->,,<!--,-->,,<!--,-->,garner,"a storehouse for threshed grain or animal feed",,,"acquire or deserve by one's efforts or actions",,,"store grain",,,"assemble or get together",,,,<!--,-->,,<!--,-->,,<!--,-->,RelatedTo
keen,"a funeral lament sung with loud wailing",,,"express grief verbally",,,"having or demonstrating ability to recognize or draw fine distinctions",,,"intense or sharp",,,"very good",,,"painful as if caused by a sharp instrument",,,"having a sharp cutting edge or point",,,competitive,"involving competition or competitiveness",,,"subscribing to capitalistic competition",,,"showing a fighting disposition",,,,<!--,-->,,<!--,-->,,<!--,-->,,<!--,-->,RelatedTo
embattled,"fortify by furnishing with battlements for defense",,,"prepare for battle or conflict",,,"prepared for battle",,,"having or resembling repeated square indentations like those in a battlement",,,,<!--,-->,,<!--,-->,,<!--,-->,debates,"a discussion in which reasons are advanced for and against some proposition or proposal",,,"the formal presentation of a stated proposition and the opposition to it (usually followed by a vote)",,,"argue with one another",,,"think about carefully; weigh",,,"discuss the pros and cons of an issue",,,"have an argument about something",,,,<!--,-->,RelatedTo
script,"a written version of a play or other dramatic composition; used in preparing for a performance",,,"something written by hand",,,"a particular orthography or writing system",,,"write a script for",,,,<!--,-->,,<!--,-->,,<!--,-->,handwriting,"something written by hand",,,"the activity of writing by hand",,,"write by hand",,,,<!--,-->,,<!--,-->,,<!--,-->,,<!--,-->,Synonym
audition,"the ability to hear; the auditory faculty",,,"a test of the suitability of a performer",,,"perform in order to get a role",,,,<!--,-->,,<!--,-->,,<!--,-->,,<!--,-->,performance,"a dramatic or musical entertainment",,,"the act of presenting a play or a piece of music or other entertainment",,,"the act of performing; of doing something successfully; using knowledge as distinguished from merely possessing it",,,"any recognized accomplishment",,,"process or manner of functioning or operating",,,,<!--,-->,,<!--,-->,RelatedTo
lectures,"a speech that is open to the public",,,"a lengthy rebuke",,,"teaching by giving a discourse on some subject (typically to a class)",,,"deliver a lecture or talk",,,"censure severely or angrily",,,,<!--,-->,,<!--,-->,conference,"a prearranged meeting for consultation or exchange of information or discussion (especially one with a formal agenda)",,,"an association of sports teams that organizes matches for its members",,,"a discussion among participants who have an agreed (serious) topic",,,,<!--,-->,,<!--,-->,,<!--,-->,,<!--,-->,AtLocation
